{
  "version": "0.3",
  "mapRevision": "office-v0.3-r1",
  "dimensions": {
    "columns": 32,
    "rows": 24,
    "tileWidth": 64,
    "tileHeight": 32
  },
  "origin": {
    "x": 1024,
    "y": 96
  },
  "roomBindings": [
    {
      "key": "boss",
      "roomId": "room_boss",
      "roomType": "boss",
      "movementEnabled": true,
      "cells": [
        {
          "col": 1,
          "row": 1
        },
        {
          "col": 2,
          "row": 1
        },
        {
          "col": 3,
          "row": 1
        },
        {
          "col": 4,
          "row": 1
        },
        {
          "col": 5,
          "row": 1
        },
        {
          "col": 6,
          "row": 1
        },
        {
          "col": 7,
          "row": 1
        },
        {
          "col": 8,
          "row": 1
        },
        {
          "col": 9,
          "row": 1
        },
        {
          "col": 10,
          "row": 1
        },
        {
          "col": 1,
          "row": 2
        },
        {
          "col": 2,
          "row": 2
        },
        {
          "col": 3,
          "row": 2
        },
        {
          "col": 4,
          "row": 2
        },
        {
          "col": 5,
          "row": 2
        },
        {
          "col": 6,
          "row": 2
        },
        {
          "col": 7,
          "row": 2
        },
        {
          "col": 8,
          "row": 2
        },
        {
          "col": 9,
          "row": 2
        },
        {
          "col": 10,
          "row": 2
        },
        {
          "col": 1,
          "row": 3
        },
        {
          "col": 2,
          "row": 3
        },
        {
          "col": 3,
          "row": 3
        },
        {
          "col": 4,
          "row": 3
        },
        {
          "col": 5,
          "row": 3
        },
        {
          "col": 6,
          "row": 3
        },
        {
          "col": 7,
          "row": 3
        },
        {
          "col": 8,
          "row": 3
        },
        {
          "col": 9,
          "row": 3
        },
        {
          "col": 10,
          "row": 3
        },
        {
          "col": 1,
          "row": 4
        },
        {
          "col": 2,
          "row": 4
        },
        {
          "col": 3,
          "row": 4
        },
        {
          "col": 4,
          "row": 4
        },
        {
          "col": 5,
          "row": 4
        },
        {
          "col": 6,
          "row": 4
        },
        {
          "col": 7,
          "row": 4
        },
        {
          "col": 8,
          "row": 4
        },
        {
          "col": 9,
          "row": 4
        },
        {
          "col": 10,
          "row": 4
        },
        {
          "col": 1,
          "row": 5
        },
        {
          "col": 2,
          "row": 5
        },
        {
          "col": 3,
          "row": 5
        },
        {
          "col": 4,
          "row": 5
        },
        {
          "col": 5,
          "row": 5
        },
        {
          "col": 6,
          "row": 5
        },
        {
          "col": 7,
          "row": 5
        },
        {
          "col": 8,
          "row": 5
        },
        {
          "col": 9,
          "row": 5
        },
        {
          "col": 10,
          "row": 5
        },
        {
          "col": 1,
          "row": 6
        },
        {
          "col": 2,
          "row": 6
        },
        {
          "col": 3,
          "row": 6
        },
        {
          "col": 4,
          "row": 6
        },
        {
          "col": 5,
          "row": 6
        },
        {
          "col": 6,
          "row": 6
        },
        {
          "col": 7,
          "row": 6
        },
        {
          "col": 8,
          "row": 6
        },
        {
          "col": 9,
          "row": 6
        },
        {
          "col": 10,
          "row": 6
        }
      ]
    },
    {
      "key": "meeting",
      "roomId": "room_meeting",
      "roomType": "meeting",
      "movementEnabled": true,
      "cells": [
        {
          "col": 12,
          "row": 1
        },
        {
          "col": 13,
          "row": 1
        },
        {
          "col": 14,
          "row": 1
        },
        {
          "col": 15,
          "row": 1
        },
        {
          "col": 16,
          "row": 1
        },
        {
          "col": 17,
          "row": 1
        },
        {
          "col": 18,
          "row": 1
        },
        {
          "col": 19,
          "row": 1
        },
        {
          "col": 20,
          "row": 1
        },
        {
          "col": 21,
          "row": 1
        },
        {
          "col": 22,
          "row": 1
        },
        {
          "col": 23,
          "row": 1
        },
        {
          "col": 24,
          "row": 1
        },
        {
          "col": 25,
          "row": 1
        },
        {
          "col": 26,
          "row": 1
        },
        {
          "col": 27,
          "row": 1
        },
        {
          "col": 28,
          "row": 1
        },
        {
          "col": 29,
          "row": 1
        },
        {
          "col": 30,
          "row": 1
        },
        {
          "col": 12,
          "row": 2
        },
        {
          "col": 13,
          "row": 2
        },
        {
          "col": 14,
          "row": 2
        },
        {
          "col": 15,
          "row": 2
        },
        {
          "col": 16,
          "row": 2
        },
        {
          "col": 17,
          "row": 2
        },
        {
          "col": 18,
          "row": 2
        },
        {
          "col": 19,
          "row": 2
        },
        {
          "col": 20,
          "row": 2
        },
        {
          "col": 21,
          "row": 2
        },
        {
          "col": 22,
          "row": 2
        },
        {
          "col": 23,
          "row": 2
        },
        {
          "col": 24,
          "row": 2
        },
        {
          "col": 25,
          "row": 2
        },
        {
          "col": 26,
          "row": 2
        },
        {
          "col": 27,
          "row": 2
        },
        {
          "col": 28,
          "row": 2
        },
        {
          "col": 29,
          "row": 2
        },
        {
          "col": 30,
          "row": 2
        },
        {
          "col": 12,
          "row": 3
        },
        {
          "col": 13,
          "row": 3
        },
        {
          "col": 14,
          "row": 3
        },
        {
          "col": 15,
          "row": 3
        },
        {
          "col": 16,
          "row": 3
        },
        {
          "col": 17,
          "row": 3
        },
        {
          "col": 18,
          "row": 3
        },
        {
          "col": 19,
          "row": 3
        },
        {
          "col": 20,
          "row": 3
        },
        {
          "col": 21,
          "row": 3
        },
        {
          "col": 22,
          "row": 3
        },
        {
          "col": 23,
          "row": 3
        },
        {
          "col": 24,
          "row": 3
        },
        {
          "col": 25,
          "row": 3
        },
        {
          "col": 26,
          "row": 3
        },
        {
          "col": 27,
          "row": 3
        },
        {
          "col": 28,
          "row": 3
        },
        {
          "col": 29,
          "row": 3
        },
        {
          "col": 30,
          "row": 3
        },
        {
          "col": 12,
          "row": 4
        },
        {
          "col": 13,
          "row": 4
        },
        {
          "col": 14,
          "row": 4
        },
        {
          "col": 15,
          "row": 4
        },
        {
          "col": 16,
          "row": 4
        },
        {
          "col": 17,
          "row": 4
        },
        {
          "col": 18,
          "row": 4
        },
        {
          "col": 19,
          "row": 4
        },
        {
          "col": 20,
          "row": 4
        },
        {
          "col": 21,
          "row": 4
        },
        {
          "col": 22,
          "row": 4
        },
        {
          "col": 23,
          "row": 4
        },
        {
          "col": 24,
          "row": 4
        },
        {
          "col": 25,
          "row": 4
        },
        {
          "col": 26,
          "row": 4
        },
        {
          "col": 27,
          "row": 4
        },
        {
          "col": 28,
          "row": 4
        },
        {
          "col": 29,
          "row": 4
        },
        {
          "col": 30,
          "row": 4
        },
        {
          "col": 12,
          "row": 5
        },
        {
          "col": 13,
          "row": 5
        },
        {
          "col": 14,
          "row": 5
        },
        {
          "col": 15,
          "row": 5
        },
        {
          "col": 16,
          "row": 5
        },
        {
          "col": 17,
          "row": 5
        },
        {
          "col": 18,
          "row": 5
        },
        {
          "col": 19,
          "row": 5
        },
        {
          "col": 20,
          "row": 5
        },
        {
          "col": 21,
          "row": 5
        },
        {
          "col": 22,
          "row": 5
        },
        {
          "col": 23,
          "row": 5
        },
        {
          "col": 24,
          "row": 5
        },
        {
          "col": 25,
          "row": 5
        },
        {
          "col": 26,
          "row": 5
        },
        {
          "col": 27,
          "row": 5
        },
        {
          "col": 28,
          "row": 5
        },
        {
          "col": 29,
          "row": 5
        },
        {
          "col": 30,
          "row": 5
        },
        {
          "col": 12,
          "row": 6
        },
        {
          "col": 13,